{
  "status": "ok",
  "metrics": {
    "durationMs": 1234,
    "exitCode": 0,
    "counts": {
      "validated": 1,
      "warnings": 0,
      "failures": 0
    }
  },
  "counts": {
    "validated": 1,
    "warnings": 0,
    "failures": 0
  },
  "tool": {
    "name": "hhfab",
    "version": "v0.41.3",
    "imageDigest": "ghcr.io/afewell-hh/hoss/hhfab@sha256:54814bbf4e8459cfb35c7cf8872546f0d5d54da9fc317ffb53eab0e137b21d7b"
  },
  "timestamp": "2025-10-05T12:34:56Z",
  "matrix": ["samples/topology-min.yaml"]
}
